{
  "$schema": "https://json-schema.org/draft/2020-12/schema",
  "$id": "https://faultline.invalid/contracts/snapshot.schema.json",
  "title": "Faultline snapshot",
  "type": "object",
  "additionalProperties": false,
  "properties": {
    "schema_version": {
      "const": 1
    },
    "id": {
      "type": "string",
      "pattern": "^[A-Za-z0-9][A-Za-z0-9:_-]{0,127}$"
    },
    "workspace_id": {
      "type": "string",
      "pattern": "^[A-Za-z0-9][A-Za-z0-9:_-]{0,127}$"
    },
    "case_id": {
      "type": "string",
      "pattern": "^[A-Za-z0-9][A-Za-z0-9:_-]{0,127}$"
    },
    "revision_id": {
      "type": "string",
      "pattern": "^[A-Za-z0-9][A-Za-z0-9:_-]{0,127}$"
    },
    "source_id": {
      "type": "string",
      "pattern": "^[A-Za-z0-9][A-Za-z0-9:_-]{0,127}$"
    },
    "adapter_version": {
      "type": "string",
      "minLength": 1,
      "maxLength": 100
    },
    "created_at": {
      "type": "string",
      "format": "date-time",
      "pattern": "^\\d{4}-\\d{2}-\\d{2}T\\d{2}:\\d{2}:\\d{2}\\.\\d{3}Z$"
    },
    "content_hash": {
      "type": "string",
      "pattern": "^[a-f0-9]{64}$"
    },
    "files": {
      "type": "array",
      "items": {
        "type": "object",
        "additionalProperties": false,
        "properties": {
          "path": {
            "type": "string",
            "maxLength": 240,
            "pattern": "^(?!/)(?!.*(?:^|/)\\.\\.(?:/|$))[A-Za-z0-9._/-]+$"
          },
          "sha256": {
            "type": "string",
            "pattern": "^[a-f0-9]{64}$"
          },
          "size_bytes": {
            "type": "integer",
            "minimum": 0,
            "maximum": 9007199254740991
          },
          "media_type": {
            "type": "string",
            "minLength": 1,
            "maxLength": 128
          }
        },
        "required": [
          "path",
          "sha256",
          "size_bytes",
          "media_type"
        ]
      },
      "minItems": 1,
      "maxItems": 100
    },
    "coverage": {
      "$ref": "coverage.schema.json"
    },
    "record_count": {
      "type": "integer",
      "minimum": 0,
      "maximum": 9007199254740991
    },
    "source_mode": {
      "type": "string",
      "enum": [
        "fixture",
        "live",
        "file"
      ]
    },
    "evidence_ids": {
      "type": "array",
      "items": {
        "type": "string",
        "pattern": "^[A-Za-z0-9][A-Za-z0-9:_-]{0,127}$"
      },
      "minItems": 0,
      "maxItems": 100000
    }
  },
  "required": [
    "schema_version",
    "id",
    "workspace_id",
    "case_id",
    "revision_id",
    "source_id",
    "adapter_version",
    "created_at",
    "content_hash",
    "files",
    "coverage",
    "record_count",
    "source_mode",
    "evidence_ids"
  ]
}
