{
  "schema_version": 1,
  "id": "snapshot-fixture",
  "workspace_id": "workspace-fixture",
  "case_id": "case-fixture",
  "revision_id": "revision-1",
  "source_id": "synthetic-analytics",
  "adapter_version": "import-v1",
  "created_at": "2026-10-09T12:00:00.000Z",
  "content_hash": "b7b74494ec2dce465235f90dee685bc18212591b2fb13e521722d2435f927d35",
  "files": [
    {
      "path": "events.json",
      "sha256": "a8198524f58e72b56283ab71ebddada22840f108b46ef7165bb3fca9919c5558",
      "size_bytes": 100,
      "media_type": "application/json"
    }
  ],
  "coverage": {
    "extraction_status": "complete",
    "basis": "operator_attestation",
    "covered_start": "2026-09-01T00:00:00.000Z",
    "covered_end": "2026-09-03T00:30:00.000Z",
    "event_watermark": "2026-09-03T00:30:00.000Z",
    "attestation": "Original deterministic synthetic data; complete by construction. This is not external-source evidence.",
    "event_time_intervals": [
      {
        "start": "2026-09-01T00:00:00.000Z",
        "end": "2026-09-03T00:30:00.000Z"
      }
    ]
  },
  "record_count": 2310,
  "source_mode": "fixture",
  "evidence_ids": [
    "evidence-1"
  ]
}
